{
  "schemaVersion": 1,
  "workflowRunId": "run_abcd1234",
  "runnerExecutionId": "rex_valid_spec_acks",
  "artifactReferences": [
    {
      "artifactId": "art_spec0006",
      "artifactType": "spec",
      "contentReference": "artifacts/run_abcd1234/spec-v6.md",
      "clarificationAcknowledgements": [
        {
          "questionId": "Q-001",
          "addressed": true
        },
        {
          "questionId": "Q-002",
          "addressed": false
        }
      ]
    }
  ],
  "normalizedOutput": {
    "summary": "Regenerated specification acknowledging accepted clarifications",
    "outcome": "success"
  },
  "checksum": {
    "algorithm": "SHA-256",
    "hexDigest": "aaaaaaaaaaaaaaaaaaaaaaaaaaaaaaaaaaaaaaaaaaaaaaaaaaaaaaaaaaaaaaaa"
  },
  "classification": "shareable-redacted",
  "failureCategory": null
}
